{
  "artifact_id": "idea-intake-v2-example",
  "attachments": [],
  "constraints": {
    "production_target": "current_vps"
  },
  "correlation_id": "example-correlation-v2",
  "created_at": "2026-07-29T00:00:00Z",
  "delivery_mode": "existing_repository",
  "goal_text": "Добавить проверяемый API и автономно выпустить исправление",
  "idempotency_key": "aaaaaaaaaaaaaaaaaaaaaaaaaaaaaaaaaaaaaaaaaaaaaaaaaaaaaaaaaaaaaaaa",
  "language": "ru",
  "owner_id": "owner",
  "product_id": "example-product-v2",
  "redactions": [],
  "repository_name": null,
  "repository_url": "https://github.com/brullik/example-private",
  "repository_visibility": "private",
  "schema_version": "2.0",
  "source": "cli"
}
